{
  "id": "<kaggle-username>/hearthline-arc-agi-2-2026",
  "title": "Hearthline ARC-AGI-2 2026",
  "code_file": "arc2_submission.ipynb",
  "language": "python",
  "kernel_type": "notebook",
  "is_private": true,
  "enable_gpu": false,
  "enable_tpu": false,
  "enable_internet": false,
  "machine_shape": "",
  "dataset_sources": [],
  "competition_sources": [
    "arc-prize-2026-arc-agi-2"
  ],
  "kernel_sources": [],
  "model_sources": []
}
